<?xml version="1.0" encoding="utf-8"?>
<Content
  Version="3.5"
  xsi:schemaLocation="http://schemas.ntreev.com/crema/tables/Export/CremaProjectInfo ../Templates/ProjectInfo.xsd"
  ProjectInfo.ModifiedDateTime="2017-10-31T06:48:14.6123738Z"
  ProjectInfo.Count="8"
  ProjectInfo.ID="dea31cbb-0fbd-40b7-9e09-bf11038a3aca"
  ProjectInfo.ExportInfo.Count="8"
  ProjectInfo.ExportInfo.ID="a9ca9738-2c3f-41a3-b380-98987977e42e" xmlns:xsi="http://www.w3.org/2001/XMLSchema-instance" xmlns="http://schemas.ntreev.com/crema/tables/Templates/ProjectInfo">
  <ProjectInfo
    CreatedDateTime="2017-10-31T06:48:14.6113731Z"
    ModifiedDateTime="2017-10-31T06:48:14.6113731Z"
    RelationID="415f7e9d783caab07d757277ad1004f5">
    <ProjectType>Client</ProjectType>
    <Name>Ntreev.Crema.Client.SmartSet</Name>
    <ProjectPath>client/Ntreev.Crema.Client.SmartSet/Ntreev.Crema.Client.SmartSet.csproj</ProjectPath>
    <ExportInfo
      CreatedDateTime="2017-10-31T06:48:14.6193786Z"
      ModifiedDateTime="2017-10-31T06:48:14.6193786Z">
      <ID>1</ID>
      <FileName />
      <TableName>ClientSmartSet</TableName>
    </ExportInfo>
  </ProjectInfo>
  <ProjectInfo
    CreatedDateTime="2017-10-31T06:48:14.6113731Z"
    ModifiedDateTime="2017-10-31T06:48:14.6113731Z"
    RelationID="12335022f6c40f80a1d60fed1216fee2">
    <ProjectType>Client</ProjectType>
    <Name>Ntreev.Crema.Client.Common</Name>
    <ProjectPath>client/Ntreev.Crema.Client.Common/Ntreev.Crema.Client.Common.csproj</ProjectPath>
    <ExportInfo
      CreatedDateTime="2017-10-31T06:48:14.6213826Z"
      ModifiedDateTime="2017-10-31T06:48:14.6213826Z">
      <ID>2</ID>
      <FileName />
      <TableName>ClientCommon</TableName>
    </ExportInfo>
  </ProjectInfo>
  <ProjectInfo
    CreatedDateTime="2017-10-31T06:48:14.6118736Z"
    ModifiedDateTime="2017-10-31T06:48:14.6118736Z"
    RelationID="e9bf26bd43c00da6d59b2991e893384e">
    <ProjectType>Client</ProjectType>
    <Name>Ntreev.Crema.Client.Tables</Name>
    <ProjectPath>client/Ntreev.Crema.Client.Tables/Ntreev.Crema.Client.Tables.csproj</ProjectPath>
    <ExportInfo
      CreatedDateTime="2017-10-31T06:48:14.6218804Z"
      ModifiedDateTime="2017-10-31T06:48:14.6218804Z">
      <ID>4</ID>
      <FileName />
      <TableName>ClientTables</TableName>
    </ExportInfo>
  </ProjectInfo>
  <ProjectInfo
    CreatedDateTime="2017-10-31T06:48:14.6118736Z"
    ModifiedDateTime="2017-10-31T06:48:14.6118736Z"
    RelationID="43739410bb3bdaa77399dc0ddf1660a2">
    <ProjectType>Common</ProjectType>
    <Name>Ntreev.Crema.Presentation</Name>
    <ProjectPath>common/Ntreev.Crema.Presentation/Ntreev.Crema.Presentation.csproj</ProjectPath>
    <ExportInfo
      CreatedDateTime="2017-10-31T06:48:14.6218804Z"
      ModifiedDateTime="2017-10-31T06:48:14.6218804Z">
      <ID>5</ID>
      <FileName />
      <TableName>CommonPresentation</TableName>
    </ExportInfo>
  </ProjectInfo>
  <ProjectInfo
    CreatedDateTime="2017-10-31T06:48:14.6118736Z"
    ModifiedDateTime="2017-10-31T06:48:14.6118736Z"
    RelationID="87ec3c57e41e0c1e70b5df0fc86b0b47">
    <ProjectType>SubModule</ProjectType>
    <Name>Ntreev.ModernUI.Framework</Name>
    <ProjectPath>sub-modules/Ntreev.ModernUI.Framework/Ntreev.ModernUI.Framework/Ntreev.ModernUI.Framework.csproj</ProjectPath>
    <ExportInfo
      CreatedDateTime="2017-10-31T06:48:14.6218804Z"
      ModifiedDateTime="2017-10-31T06:48:14.6218804Z">
      <ID>0</ID>
      <FileName />
      <TableName>ModernUIFramework</TableName>
    </ExportInfo>
  </ProjectInfo>
  <ProjectInfo
    CreatedDateTime="2017-10-31T06:48:14.6118736Z"
    ModifiedDateTime="2017-10-31T06:48:14.6118736Z"
    RelationID="d033476fdf69a1f39f78e8a9e9006262">
    <ProjectType>Client</ProjectType>
    <Name>Ntreev.Crema.Client.Converters</Name>
    <ProjectPath>client/Ntreev.Crema.Client.Converters/Ntreev.Crema.Client.Converters.csproj</ProjectPath>
    <ExportInfo
      CreatedDateTime="2017-10-31T06:48:14.6218804Z"
      ModifiedDateTime="2017-10-31T06:48:14.6218804Z">
      <ID>3</ID>
      <FileName />
      <TableName>ClientConverters</TableName>
    </ExportInfo>
  </ProjectInfo>
  <ProjectInfo
    CreatedDateTime="2017-10-31T06:48:14.6123738Z"
    ModifiedDateTime="2017-10-31T06:48:14.6123738Z"
    RelationID="7db47cc536bb01b0be5d91233da11ea1">
    <ProjectType>Client</ProjectType>
    <Name>Ntreev.Crema.Client.Types</Name>
    <ProjectPath>client/Ntreev.Crema.Client.Types/Ntreev.Crema.Client.Types.csproj</ProjectPath>
    <ExportInfo
      CreatedDateTime="2017-10-31T06:48:14.6223809Z"
      ModifiedDateTime="2017-10-31T06:48:14.6223809Z">
      <ID>6</ID>
      <FileName />
      <TableName>ClientTypes</TableName>
    </ExportInfo>
  </ProjectInfo>
  <ProjectInfo
    CreatedDateTime="2017-10-31T06:48:14.6123738Z"
    ModifiedDateTime="2017-10-31T06:48:14.6123738Z"
    RelationID="e6d11746991707aed6074138a306d52f">
    <ProjectType>Client</ProjectType>
    <Name>Ntreev.Crema.Client.Framework</Name>
    <ProjectPath>client/Ntreev.Crema.Client.Framework/Ntreev.Crema.Client.Framework.csproj</ProjectPath>
    <ExportInfo
      CreatedDateTime="2017-10-31T06:48:14.6223809Z"
      ModifiedDateTime="2017-10-31T06:48:14.6223809Z">
      <ID>7</ID>
      <FileName />
      <TableName>ClientFramework</TableName>
    </ExportInfo>
  </ProjectInfo>
</Content>